image,start,end,text
1.jpg,0,2,Nobody is talking about Japan.
2.jpg,2,4,That is exactly the problem.
3.jpg,4,7,"While the world argues about Argentina and France,"
4.jpg,7,10,Japan has been building something different.
5.jpg,10,12,Something quiet? Something dangerous.
6.jpg,12,16,"In 2022, they beat Germany."
7.jpg,16,19,They beat Spain. Everyone called it a miracle.
8.jpg,19,22,It wasn't. It was a system.
9.jpg,22,25,"A machine built on discipline, speed, and zero-fear."
10.jpg,25,28,And that machine has only gotten stronger.
11.jpg,28,31,"Their young players are not just talented,"
12.jpg,31,33,they are terrifyingly well-coached.
13.jpg,33,35,Every pass has a purpose.
14.jpg,35,37,Every run is rehearsed a thousand times.
15.jpg,37,39,So why does nobody fear them
16.jpg,39,42,because giants never see the storm until it's already
17.jpg,42,43,on top of them?
18.jpg,43,46,"Brazil has flair, Argentina has messy shadow,"
19.jpg,46,49,France has chaos waiting to explode.
20.jpg,49,53,"Japan has none of that baggage, just preparation."
21.jpg,53,55,What happens when a team with
22.jpg,55,57,Noigo meets a team full of pressure?
23.jpg,57,59,History already gave us the answer once.
24.jpg,59,64,"In 2026, Japan won't be the underdog story anymore."
25.jpg,64,66,"They will be the team every favorite,"
26.jpg,66,68,quietly fears in the tunnel.
27.jpg,68,70,Nobody was talking about Japan.
28.jpg,70,72,"After this world cup, everyone will be."